### ISSUE TITLE
AIX - emfile failing test

### ISSUE THREAD

**Issue by iWuzHere** [libuv/libuv#845]
From https://ci.nodejs.org/job/libuv-test-commit-aix/nodes=aix61-ppc64/41/console

```
[%  75|+ 211|-   2|T   0|S   2]: emfile
`emfile` failed: exit code 393222
Output from process `emfile`:
Assertion failed in test/test-emfile.c on line 104: 0 == status
=============================================================
```

Would it be possible to have this issue assigned to me?
(creating separate issue as discussed in https://github.com/libuv/libuv/issues/719)

**Comment by iWuzHere** [comment]
Issue occurs in `uv__emfile_trick` where after freeing the spare fd we get a `EAGAIN` error from `uv__accept`

**Comment by saghul** [comment]
> Would it be possible to have this issue assigned to me?

We can't assign issues unless you have write access to the repo :-S At any rate, consider all AIX issues yours :-)

**Comment by iWuzHere** [comment]
So currently whats happening:

### Linux
Enter `uv__server_io`
We attempt `uv__accept` -> fails with `EMFILE`
Go into `uv__emfile_trick`
Free spare fd
Call `uv_accept` -> succeeds
Close `peerfd`
Call `uv_accept` (since in loop)  -> fails with `EAGAIN`, exit loop
Re-open spare fd and save as emfile fd  -> succeeds
Leave `uv__server_io`

In `uv__tcp_connect`
`getsockopt` returns 0 for error -> test succeeds


### AIX
Enter `uv__server_io`
We attempt `uv__accept` -> fails with `EMFILE`
Go into `uv__emfile_trick`
Free spare fd
Call `uv_accept` (since in loop)  -> fails with `EAGAIN`, exit loop
**Never accepted connection despite having free fd**
Re-open spare fd and save as emfile fd  -> succeeds
Leave `uv__server_io`

In `uv__tcp_connect`
`getsockopt` returns `ECONNRESET` for error -> test fails as status != 0


Not entirely sure why are not accepting the connection on AIX

**Comment by iWuzHere** [comment]
So found out something interesting

### linux

```
535             getsockopt(31,
>>> 
540         err = uv__accept(uv__stream_fd(stream));
>>> print error
$1 = 0
>>> n
trying accept with 10
541             getsockopt(31,
>>> print err
$2 = -24
>>> n
546         if (err < 0) {
>>> print error
$3 = 0
```

This is in `uv__server_io`
Our client socket ( hard coded 31 in this case as it always will be for this test case ) has no error before and after our first attempt at `uv__accept` (determining if we need to do emfile trick )

### AIX
```
(gdb) 
537     getsockopt(31,
(gdb) 
542         err = uv__accept(uv__stream_fd(stream));
(gdb) print error
$1 = 0
(gdb) n
trying accept with 10
543      getsockopt(31,
(gdb) print err
$2 = -24
(gdb) n
548        if (err < 0) {
(gdb) print error
$3 = 73
(gdb) 
```

Same scenario as linux (above) but this time after our first `uv__accept` fails with `EMFILE` the client socket now has `ECONNRESET` set on it, meaning we wont be able to accept a connection from it when we try `uv__emfile_trick`

Considering this is, should `uv__emfile_trick` be disabled on AIX and test skipped?
@saghul, @bnoordhuis, @cjihrig any input?

**Comment by saghul** [comment]
I'm not familiar enough with AIX to make a judgement call, but if failing
to accept() a connection triggers an error on the client socket I guess the
EMFILE trick will never work, so we might as well skip it there.

**Comment by bnoordhuis** [comment]
Does that mean the AIX kernel sends a RST to the client?  Because if that is the case, then yes, calling `uv__emfile_trick()` isn't that useful (although not particularly harmful either.)

**Comment by iWuzHere** [comment]
Looks like we are getting a RST to the client here is the following tcdump output on linux and aix

### linux

```
imran@tp-iqbali  ~/node/libuv   v1.x ●  sudo tcpdump -vv -i lo 'port 9123'
tcpdump: listening on lo, link-type EN10MB (Ethernet), capture size 65535 bytes
14:48:46.526621 IP (tos 0x0, ttl 64, id 62546, offset 0, flags [DF], proto TCP (6), length 60)
    localhost.51997 > localhost.9123: Flags [S], cksum 0xfe30 (incorrect -> 0x0c4c), seq 2246888780, win 43690, options [mss 65495,sackOK,TS val 499857694 ecr 0,nop,wscale 7], length 0
14:48:46.526635 IP (tos 0x0, ttl 64, id 0, offset 0, flags [DF], proto TCP (6), length 60)
    localhost.9123 > localhost.51997: Flags [S.], cksum 0xfe30 (incorrect -> 0x1f0f), seq 2817322581, ack 2246888781, win 43690, options [mss 65495,sackOK,TS val 499857694 ecr 499857694,nop,wscale 7], length 0
14:48:46.526648 IP (tos 0x0, ttl 64, id 62547, offset 0, flags [DF], proto TCP (6), length 52)
    localhost.51997 > localhost.9123: Flags [.], cksum 0xfe28 (incorrect -> 0xf153), seq 1, ack 1, win 342, options [nop,nop,TS val 499857694 ecr 499857694], length 0
14:48:46.526717 IP (tos 0x0, ttl 64, id 55112, offset 0, flags [DF], proto TCP (6), length 52)
    localhost.9123 > localhost.51997: Flags [F.], cksum 0xfe28 (incorrect -> 0xf152), seq 1, ack 1, win 342, options [nop,nop,TS val 499857694 ecr 499857694], length 0
14:48:46.526754 IP (tos 0x0, ttl 64, id 62548, offset 0, flags [DF], proto TCP (6), length 52)
    localhost.51997 > localhost.9123: Flags [F.], cksum 0xfe28 (incorrect -> 0xf151), seq 1, ack 2, win 342, options [nop,nop,TS val 499857694 ecr 499857694], length 0
14:48:46.526766 IP (tos 0x0, ttl 64, id 55113, offset 0, flags [DF], proto TCP (6), length 52)
    localhost.9123 > localhost.51997: Flags [.], cksum 0xfe28 (incorrect -> 0xf151), seq 2, ack 2, win 342, options [nop,nop,TS val 499857694 ecr 499857694], length 0
```

### AIX

```
bash-4.3# tcpdump -vv -i lo0 'port 9123'
tcpdump: listening on lo0, link-type 0, capture size 96 bytes
15:33:27.666492 IP (tos 0x0, ttl  60, id 4949, offset 0, flags [DF], proto: TCP (6), length: 60, bad cksum 0 (->2d65)!) loopback.43178 > loopback.9123: S, cksum 0x0000 (incorrect -> 0x0217) 1179124639:1179124639(0) win 65535 <mss 16856,nop,wscale 2,nop,nop,timestamp 1463853395 0>
15:33:27.666515 IP (tos 0x0, ttl  60, id 4950, offset 0, flags [DF], proto: TCP (6), length: 60, bad cksum 0 (->2d64)!) loopback.9123 > loopback.43178: S, cksum 0x0000 (incorrect -> 0x4827) 34324287:34324287(0) ack 1179124640 win 65535 <mss 16856,nop,wscale 2,nop,nop,timestamp 1463853395 1463853395>
15:33:27.666522 IP (tos 0x0, ttl  60, id 4951, offset 0, flags [DF], proto: TCP (6), length: 52, bad cksum 0 (->2d6b)!) loopback.43178 > loopback.9123: ., cksum 0x0000 (incorrect -> 0x2c79) 1:1(0) ack 1 win 33688 <nop,nop,timestamp 1463853395 1463853395>
15:33:27.666528 IP (tos 0x0, ttl  60, id 4952, offset 0, flags [DF], proto: TCP (6), length: 52, bad cksum 0 (->2d6a)!) loopback.9123 > loopback.43178: ., cksum 0x0000 (incorrect -> 0x2c79) 1:1(0) ack 1 win 33688 <nop,nop,timestamp 1463853395 1463853395>
15:33:27.666644 IP (tos 0x0, ttl  60, id 4954, offset 0, flags [DF], proto: TCP (6), length: 52, bad cksum 0 (->2d68)!) loopback.9123 > loopback.43178: R, cksum 0x0000 (incorrect -> 0x2c75) 1:1(0) ack 1 win 33688 <nop,nop,timestamp 1463853395 1463853395>
```

The last line with `loopback.9123 > loopback.43178: R,`  is the RST packet, [source](https://fwknowledge.wordpress.com/2013/03/05/tcpdump-flags/)

I'll create a PR for skipping the test on AIX
