### DISCUSSION TITLE
How to set the max retransmission count on a uvlib TCP client?

### DISCUSSION THREAD

**Discussion by thiezn** [libuv/libuv#3900] [Q&A] [answered]
Hi,

I am using uvlib to build a client that sets up a large number of asynchronous connections to hosts. The hosts are often not existing or behind a firewall.

The operating system connection timeout and retransmission timeouts are typically quite generous so I am using setsockopt to change the TCP_CONNECTIONTIMEOUT value per connection to a more sensible timeout. 

```c
int sockfd =  socket(PF_INET, SOCK_STREAM, IPPROTO_TCP);
uint32_t conn_timeout_sec = 5;
// Macos uses TCP_CONNECTIONTIMEOUT, for linux you can use TCP_USER_TIMEOUT and windows uses TCP_MAXRT
setsockopt(sockfd, IPPROTO_TCP, TCP_CONNECTIONTIMEOUT, (char *)&conn_timeout_sec, sizeof(conn_timeout_sec));
uv_tcp_open((uv_tcp_t *)tcp_thingie, sockfd);
...
```

This works great for hosts that are unreachable (don't complete the TCP handshake). However, I often come across different behaviour when a host is behind a firewall. The firewall completes the TCP handshake, but then doesn't reply at all to subsequent packets. Here's an example TCP dump output:

```sh
12:37:25.322005 IP my_host.com.53619 > target_host_behind_fw.com.666: Flags [S], seq 1108000587, win 65535, options [mss 1460,nop,wscale 6,nop,nop,TS val 2305355511 ecr 0,sackOK,eol], length 0
12:37:25.337940 IP target_host_behind_fw.com.666 > my_host.com.53619: Flags [S.], seq 2132592012, ack 1108000588, win 0, options [mss 1400], length 0
12:37:25.338059 IP my_host.com.53619 > target_host_behind_fw.com.666: Flags [.], ack 1, win 65535, length 0
12:37:30.423844 IP my_host.com.53619 > target_host_behind_fw.com.666: Flags [.], seq 1:2, ack 1, win 65535, length 1
12:37:35.424530 IP my_host.com.53619 > target_host_behind_fw.com.666: Flags [.], seq 1:2, ack 1, win 65535, length 1
12:37:40.425254 IP my_host.com.53619 > target_host_behind_fw.com.666: Flags [.], seq 1:2, ack 1, win 65535, length 1
12:37:45.517411 IP my_host.com.53619 > target_host_behind_fw.com.666: Flags [.], seq 1:2, ack 1, win 65535, length 1
12:37:50.517780 IP my_host.com.53619 > target_host_behind_fw.com.666: Flags [.], seq 1:2, ack 1, win 65535, length 1
12:37:55.986838 IP my_host.com.53619 > target_host_behind_fw.com.666: Flags [.], seq 1:2, ack 1, win 65535, length 1
12:38:01.002076 IP my_host.com.53619 > target_host_behind_fw.com.666: Flags [.], seq 1:2, ack 1, win 65535, length 1
12:38:09.254202 IP my_host.com.53619 > target_host_behind_fw.com.666: Flags [.], seq 1:2, ack 1, win 65535, length 1
12:38:17.467129 IP my_host.com.53619 > target_host_behind_fw.com.666: Flags [.], seq 1:2, ack 1, win 65535, length 1
12:38:25.702772 IP my_host.com.53619 > target_host_behind_fw.com.666: Flags [.], seq 1:2, ack 1, win 65535, length 1
12:38:34.093097 IP my_host.com.53619 > target_host_behind_fw.com.666: Flags [.], seq 1:2, ack 1, win 65535, length 1
12:38:42.285448 IP my_host.com.53619 > target_host_behind_fw.com.666: Flags [.], seq 1:2, ack 1, win 65535, length 1
12:38:50.479307 IP my_host.com.53619 > target_host_behind_fw.com.666: Flags [R.], seq 1, ack 1, win 65535, length 0
```

What would be the best way to tackle this problem? Would a uvlib timer per connection be suitable for this, or are there perhaps socket options available that I can set to decrease the retransmission amount and/or retransmission interval?

Cheers,
Thiezn

**Comment by bnoordhuis** [comment, marked as answer]
For reasons of portability and simplicity you probably want to use a timer. Timers are cheap to create and destroy; they're just data structures, no system calls involved.

**Reply by thiezn** [reply]
Thanks @bnoordhuis, that makes sense. I'll go the timer route
